commit	time_ct	tune_score	margin_mae	total_mae	ats_hit_info	total_hit_info	status	eval_s	description
market	2026-10-06 15:46	20.4521	9.8257	10.6265			reference		closing lines on the same TUNE games (reference, not a target)
72a1cec	2026-10-06 15:46	20.9505	10.0472	10.9034	0.5181	0.4740	keep	27	baseline: PR #7 v2 model rebuilt in candidate.py, walk-forward refit each season
06232d1	2026-10-06 15:47	20.9367	10.0472	10.8895	0.5181	0.4789	keep	27	totals: add indoor (dome/closed roof) flag and wind mph
9100dc6	2026-10-06 15:47	20.9375	10.0480	10.8895	0.5101	0.4789	discard	26	margin: add EPA rating difference alongside the points rating
d53b63e	2026-10-06 15:48	20.9248	10.0444	10.8804	0.5131	0.4858	keep	40	refit coefficients every week, adding this season's finished games (was once per season)
f256e28	2026-10-06 15:49	20.9276	10.0472	10.8804	0.5131	0.4858	discard	40	margin: add capped rest-day difference (byes, short weeks)
a4dbe1d	2026-10-06 16:07	20.9347	10.0438	10.8909	0.5111	0.4897	discard	58	fit: weight training games by recency (half-life 2 seasons)
market	2026-10-06 16:19	20.4521	9.8257	10.6265			reference		closing lines on the same TUNE games (reference, not a target)
b3b96da	2026-10-06 16:19	20.9523	10.0444	10.9079	0.5131	0.4779	rebaseline	57	rebaseline: harness no longer passes game-time wind; candidate = d53b63e minus the wind term
6d6bfcd	2026-10-06 16:20	20.9418	10.0444	10.8974	0.5131	0.4760	keep	59	totals: drop the roof flag (without wind it no longer helps)
